Product,Name,Price,Rating,Comment Heading,Comment
HMTe 7082 Metal Analog Men's Watch,No Name,Rs 329,5, Most Helpful Positive Review (17),Amezing suprv
HMTe 7082 Metal Analog Men's Watch,No Name,Rs 329,1, Most Helpful Critical Review (1),Poor quality
HMTe 7082 Metal Analog Men's Watch,"by Chieftain on Nov 15, 2021",Rs 329,4,Not the Best but certainly translate the price.👍,It is quite usable for day to day work but some parts are not painted evenly 😂😂😂
HMTe 7082 Metal Analog Men's Watch,"by manishyadav7258973103@gmail.com on Nov 14, 2021",Rs 329,5,Jhakash,Mst hai paisa vasool hai
HMTe 7082 Metal Analog Men's Watch,"by Shubham on Nov 09, 2021",Rs 329,5,Gjb very good watch,I like watch👌👌👌👌👌👌👌👌
HMTe 7082 Metal Analog Men's Watch,"by Prabhu on Nov 06, 2021",Rs 329,4,Colour,जल्दी स्क्रेच हो जाते है। कलर क्वालिटी अच्छी नही है
HMTe 7082 Metal Analog Men's Watch,"by Sathish on Nov 04, 2021",Rs 329,1,Damaged,Poor quality
HMTe 7082 Metal Analog Men's Watch,"by BANTY on Nov 03, 2021",Rs 329,5,Awesome,"Good ,better"
HMTe 7082 Metal Analog Men's Watch,"by Tadi on Nov 01, 2021",Rs 329,5,Excellent,It has provide good quality product
HMTe 7082 Metal Analog Men's Watch,"by sakib965317 on Oct 28, 2021",Rs 329,5,Nice 👍👍👍 thanks,Wao fantastic 😎
HMTe 7082 Metal Analog Men's Watch,"by Awesome service on Oct 28, 2021",Rs 329,4,Great product,"Nice watch in budget, love to wear it"
HMTe 7082 Metal Analog Men's Watch,"by ramlalsharma7580 on Oct 27, 2021",Rs 329,5,Ramlal,बहुत अच्छा
HMTr 7088-SILVER DAY&DATE Stainless Steel Analog Men's Watch,No Name,Rs 359,5, Most Helpful Positive Review (14),"This product is very nice 🙂👍🙂👍
I also happy to buy the product from here"
HMTr 7088-SILVER DAY&DATE Stainless Steel Analog Men's Watch,No Name,Rs 359,1, Most Helpful Critical Review (1),Silver Kalar not ok
HMTr 7088-SILVER DAY&DATE Stainless Steel Analog Men's Watch,"by Bhushan on Nov 15, 2021",Rs 359,5,good very good service,good very good service
HMTr 7088-SILVER DAY&DATE Stainless Steel Analog Men's Watch,"by Akash on Nov 14, 2021",Rs 359,5,Packing,I like very this watch very much
HMTr 7088-SILVER DAY&DATE Stainless Steel Analog Men's Watch,"by Jasveer Nayak on Nov 10, 2021",Rs 359,5,nice product,5 rating in this product very good
HMTr 7088-SILVER DAY&DATE Stainless Steel Analog Men's Watch,"by niraj on Nov 10, 2021",Rs 359,4,Quality best some problem,Not good not bad
HMTr 7088-SILVER DAY&DATE Stainless Steel Analog Men's Watch,"by Shiva on Nov 08, 2021",Rs 359,5,Good looking,Good product
HMTr 7088-SILVER DAY&DATE Stainless Steel Analog Men's Watch,"by Chauhan on Nov 06, 2021",Rs 359,1,Worst Contact not ok,Silver Kalar not ok
HMTr 7088-SILVER DAY&DATE Stainless Steel Analog Men's Watch,"by Maha on Nov 06, 2021",Rs 359,5,Watch,Nice very good product.
HMTr 7088-SILVER DAY&DATE Stainless Steel Analog Men's Watch,"by Keshava on Nov 02, 2021",Rs 359,3,Watch,Not bad... Good one
HMTr 7088-SILVER DAY&DATE Stainless Steel Analog Men's Watch,"by nageswara rao on Oct 29, 2021",Rs 359,5,Delivery,"Delivery not camera to house as bludort course
Please change course next time
Other wise good quality and comparbuilty price"
HMTr 7088-SILVER DAY&DATE Stainless Steel Analog Men's Watch,"by anilkumarbansiwal20 on Oct 25, 2021",Rs 359,4,Watch,Nice but not water proof
David Miller DMRCM120 PU Analog Men's Watch,No Name,Rs 299,5, Most Helpful Positive Review (20),Glad to get a beautiful watch by Snapdeal...Fantastic product and admirable service of delivery
David Miller DMRCM120 PU Analog Men's Watch,No Name,Rs 299,3, Most Helpful Critical Review (1),I think quality is not so good as expected. Round cap or secure cap from rear side not in good conditions
David Miller DMRCM120 PU Analog Men's Watch,"by bhinderarsh83 on Oct 15, 2021",Rs 299,4,DM watch,it's very impressive and morden watch....
David Miller DMRCM120 PU Analog Men's Watch,"by MEGA on Aug 20, 2021",Rs 299,5,Quality and delivery,Very nice product got delivered very well thanks to snapdeal this watch is the best with formal clothes if you are looking for a great watch go for this one
David Miller DMRCM120 PU Analog Men's Watch,"by Gaurav on Aug 01, 2021",Rs 299,3,Quality,I think quality is not so good as expected. Round cap or secure cap from rear side not in good conditions
David Miller DMRCM120 PU Analog Men's Watch,"by Shamshu on Jul 22, 2021",Rs 299,5,NEXT LEVEL,Simply super  everybody losses their mind looking this watch  in live
David Miller DMRCM120 PU Analog Men's Watch,"by Dharmendu Mandal on Jul 17, 2021",Rs 299,4,Quality is good,"Thora pi6e ka dhakkan luse hai 
Quality is good ☺️"
David Miller DMRCM120 PU Analog Men's Watch,"by Amrita on Jul 09, 2021",Rs 299,5,Good product,I like this product
David Miller DMRCM120 PU Analog Men's Watch,"by Ayush on Jun 13, 2021",Rs 299,4,Good Product,Nice looking
David Miller DMRCM120 PU Analog Men's Watch,"by Jitendra kumar on Jun 11, 2021",Rs 299,5,Good watch,Smart lock and nice watch
David Miller DMRCM120 PU Analog Men's Watch,"by Sarbjit on Jun 10, 2021",Rs 299,5,"Gone diffective,not long life",Bad quality
David Miller DMRCM120 PU Analog Men's Watch,"by raikwarharshita741 on Jun 02, 2021",Rs 299,5,Best Quality,Very best product
